Author,BookTitle,Date,PriceAPaperback,PriceBkindle,Ratings,SummaryAuthor,XcoverPicture
Salman Rushdie,  Victory City: A Novel ,"  Hardcover – February 7, 2023 ", 24.99 , 13.99 ,,"“[An] awe-inspiring saga that looks at what it’s really like to be the center of the universe.”,—,Time, (one of the most anticipated books of 2023),“It’s splendid that Salman Rushdie has a new novel out. . . . Better still, it’s a cracker. Purportedly a rediscovered ancient epic, it’s about the transformative power of human creativity, the enduring ability of art to shape the world.”,—,The Guardian, (fiction to look out for in 2023),“Rushdie has already proven himself of his generation’s most adept literary stars, and his forthcoming epic fantasy novel promises to be one of the best releases of the year.”,—,The Week, (one of the must-read books in early 2023),“Salman Rushdie has created a radiant myth about mythmaking. ,Victory City, is a book that privileges the ethical imagination and the unmistakable permanence of storytelling. Within these pages, you will find global travelers, rapacious kings, cave dwellers, prophets of doom, and, at its fierce and eloquent heart, a storyteller who reminds us that death may take away a lot of things, but never the power of our words. Beyond war, beyond violence, even beyond life itself, the story, and the storyteller, last.”,—Colum McCann,“,Victory City, is vast and deep, soaring and scintillating. Every page is magical, every page is gorgeous. In the way of a significant work of art, it does not resemble any other novel I could name . . . A major accomplishment by one of our greatest living writers.”,—Michael Cunningham,“Salman Rushdie is a genius and I wish he could read me a story—or a chapter of his book—every night before bed. The scale and scope of his intellect and his imagination is googolplex, as big as infinity and then some. In ,Victory City,, he spins an epic tale that brings us back to the key questions of what it is to be human, to be authentic, to love and to grieve.”,—A. M. Homes,“No one, and I mean no one, can bring an entire world to life with the authority, wisdom, humor, and panache of Salman Rushdie. In the pantheon of his novels, ,Victory City, stands out as book of particular imaginative achievement. It defies category, but it invites pleasure.”,—Gary Shteyngart,“,Victory City, is a capacious and sweeping telling in which writing about the past is a way of also staring dead on at the present and historicizing human nature. In the wit and poetry of his prose, Rushdie shows us not only the world we’ve made, but—more importantly—the one we can remake.”,—Natasha Trethewey,“This is Salman Rushdie at his most virtuosic, a wondrous tale of medieval India which is also, as ever, a fable about the triumph of life—in all its joyous, messy excess—over the forces of fanaticism and darkness.”,—Hari Kunzru,Salman Rushdie, is the author of fourteen previous novels, including ,Midnight’s Children, (for which he won the Booker Prize and the Best of the Booker), ,Shame, The Satanic Verses, The Moor’s Last Sigh,, and ,Quichotte,, all of which have been shortlisted for the Booker Prize; a collection of stories, ,East, West;, a memoir, ,Joseph Anton;, a work of reportage, ,The Jaguar Smile;, and three collections of essays, most recently ,Languages of Truth,. His many awards include the Whitbread Prize for Best Novel, which he won twice; the PEN/Allen Foundation Literary Service Award; the National Arts Award; the French Prix du Meilleur Livre Étranger; the European Union’s Aristeion Prize for Literature; the Budapest Grand Prize for Literature; and the Italian Premio Grinzane Cavour. He is a member of the American Academy of Arts and Letters and a fellow of the American Academy of Arts and Sciences, and he is a Distinguished Writer in Residence at New York University. He is a former president of PEN America. His books have been translated into over forty languages.",
Karen Marie Moning,  Bloodfever: Fever Series Book 2 ,  Kindle Edition , 6.99 ," 23.80 , 11.78 , 8.99 , 14.99 ","2,689 ",,
,  The Prose Edda: Norse Mythology (Penguin Classics) ,"   Illustrated, January 31, 2006 ", 15.99 , 9.99 ,"1,910 ","Snorri Sturluson, (1179–1241) was the son of an upstart Icelandic chieftain. He rose to become Iceland’s richest and, for a time, most powerful leader.,Jesse Byock, is a professor of Icelandic and Old Norse studies at UCLA. He is the translator of ,The Saga of the Volsungs, and ,The Saga of King Hrolf Kraki, for Penguin Classics.",https://m.media-amazon.com/images/G/01/digital/sitb/sticker/sitb-sticker-v3-small._CB485933792_.png
Erik Zidowecki,  Dual Language Word Searches - English - Irish - Volume 1 ,"   April 17, 2020 ", 9.99 ,,6 ,,https://m.media-amazon.com/images/G/01/digital/sitb/sticker/sitb-sticker-v3-small._CB485933792_.png
Paulo Coelho,  The Alchemist: 25th Anniversary Edition ,"  Hardcover – September 9, 2014 ", 23.39 ," 9.99 , 10.40 , 26.58 ","5,801 ",,
Lingo Mastery,  Learn English With Cartoons: A Fun Vocabulary Builder Workbook ,"   June 9, 2021 ", 13.90 ,,116 ,,https://m.media-amazon.com/images/G/01/digital/sitb/sticker/sitb-sticker-v3-small._CB485933792_.png
Charlotte E. English,"  The Road to Farringale: Modern Magick, 1 ",  Kindle Edition , 0.00 , 8.99 ,656 ,"Praise for the Modern Magick series:,'Charming, quirky, and funny.','Enjoyable and imaginative fantasy series with whimsical overtones... A fresh magical world.','This is an incredibly entertaining story... help, I'm running out of superlatives.','The writing is excellent and fun... a rousing, gripping adventure. ','...delightfully fun, whimsical and engaging, with great characters and settings.','If you like Jodi Taylor's St Mary's books, this is for you.','...quirky and fun and I couldn't ask for more... Her usual unique charm.',''...characters that are easy to love, an invisible boss and a house that seems to have a mind of it's own. I devoured the book in one sitting.','Written with charm and intelligence, this series is a delight to read!','...the pages just seem to fly by! Can't wait to read the next one.','...the entire quirky cast is fun and endearing... our heroine is a delightful companion for adventure.'",
Nevil Shute,  Trustee from the Toolroom (Vintage International) ,  Kindle Edition , 4.99 ," 69.91 , 21.46 , 28.46 , 34.09 ","2,082 ","“Enormously popular, possibly the best-liked of all Shute’s novels.” —,Daily Express, ,“The surest bestseller. . . . As good as everything he ever wrote.” —,Sunday Times ,  ,“Something about this author’s calm, deliberate style creates unexpected excitement. . . . We are warmed by the justice and sheer pleasure of it.” —,The Independent, , ,“A novelist of intelligent and engaging quality, deservedly popular…. Nevil Shute was, in brief, the sort of novelist who genuinely touches the imagination and feeling.” —,The Times ,(London),Nevil Shute Norway was born on 17 January 1899 in Ealing, London.After attending the Dragon School and Shrewsbury School, he studied Engineering Science at Balliol College, Oxford. He worked as an aeronautical engineer and published his first novel, Marazan, in 1926. In 1931 he married Frances Mary Heaton and they went on to have two daughters. During the Second World War he joined the Royal Navy Volunteer Reserve where he worked on developing secret weapons. After the war he continued to write and settled in Australia where he lived until his death on 12 January 1960. His most celebrated novels include Pied Piper (1942), No Highway (1948), A Town Like Alice (1950) and On the Beach (1957).,--This text refers to an alternate , edition.",
Ruth S. Noel,  The Languages of Tolkien's Middle-Earth: A Complete Guide to All Fourteen of the Languages Tolkien Invented ,"   Illustrated, May 28, 1980 ", 13.69 , 200.38 ,420 ,"J.R.R. TOLKIEN (1892–1973) is the creator of Middle-earth and author of such classic and extraordinary works of fiction as ,The Hobbit, The Lord of the Rings,, and ,The Silmarillion., His books have been translated into more than fifty languages and have sold many millions of copies worldwide.",https://m.media-amazon.com/images/G/01/digital/sitb/sticker/sitb-sticker-v3-small._CB485933792_.png
Tomihiko Morimi,  The Tatami Galaxy: A Novel ,"  Hardcover – December 6, 2022 ", 22.49 ," 13.99 , 18.99 , 32.37 ",17 ,,https://m.media-amazon.com/images/G/01/digital/sitb/sticker/sitb-sticker-v3-small._CB485933792_.png
Kafka Asagiri,"  Bungo Stray Dogs, Vol. 1 (light novel): Osamu Dazai's Entrance Exam (Bungo Stray Dogs (light novel), 1) ","   Illustrated, August 20, 2019 ", 14.00 , 7.99 ,614 ,,https://m.media-amazon.com/images/G/01/digital/sitb/sticker/sitb-sticker-v3-small._CB485933792_.png
Heather C. McCombs,  LEED Green Associate Exam™ Preparation Guide ,  1st Edition , 110.00 ,,112 ,,
,"  That Time I Got Reincarnated as a Slime, Vol. 10 (light novel) (That Time I Got Reincarnated as a Slime (light novel)) ",  Kindle Edition , 8.99 , 15.00 ,"1,688 ","Fuse is the author of ,That Time I Got Reincarnated as a Slime,., Mitz Vah is the artist for ,That Time I Got Reincarnated as a Slime,.,--This text refers to the , edition.",
Robin Gillingham,  D.A.R.E Detectives: The Mystery on Lovett Lane (Dyslexia Font) (Dyslexia Reading Books for Kids Age 8-12) ,"   August 11, 2022 ", 9.90 ,,40 ,,https://m.media-amazon.com/images/G/01/digital/sitb/sticker/sitb-sticker-v3-small._CB485933792_.png
Jack McDevitt,  Village in the Sky (An Alex Benedict Novel Book 9) ,  Kindle Edition , 12.99 , 28.99 ,5 ,"Jack McDevitt is the Nebula Award–winning author of The Academy series, including ,The Long Sunset,. He attended La Salle University, then joined the Navy, drove a cab, became an English teacher, took a customs inspector’s job on the northern border, and didn’t write another word for a quarter-century. He received a master’s degree in literature from Wesleyan University in 1971. He returned to writing when his wife, Maureen, encouraged him to try his hand at it in 1980. Along with winning the Nebula Award in 2006, he has also been nominated for the Hugo Award, the Nebula Award, the Arthur C. Clarke Award, the John W. Campbell Memorial Award, and the Philip K. Dick Award. In 2015, he was awarded the Robert A. Heinlein Award for Lifetime Achievement. He and his wife live near Brunswick, Georgia.,--This text refers to the , edition.",
Agustina Bazterrica,  Tender Is the Flesh ,"   August 4, 2020 ", 13.79 ," 12.99 , 29.99 ","10,394 ","PRAISE FOR TENDER IS THE FLESH BY AGUSTINA BAZTERRICA, WINNER OF ARGENTINA’S CLARÍN NOVELA PRIZE 2017, , “From the first words of the Argentine novelist Agustina Bazterrica’s second novel, “Tender Is the Flesh,” the reader is already the livestock in the line, reeling, primordially aware that this book is a butcher’s block, and nothing that happens next is going to be pretty.”, —,New York Times Book Review, , ""The novel is horrific, yes, but fascinatingly provocative (and Orwellian) in the way it exposes the lengths society will go to deform language and avoid moral truths."", —,Taylor Antrim, ,Vogue, , “Taut and thought-provoking...a chilling and alarmingly prophetic book...this is an urgent cautionary tale...timely, crucial.”, ,—,Words Without Borders, , ""A ruthlessly clever, Orwellian satire of our dog-eat-dog, er, man-eat-man modern world."", ,—,NJ.com, , “It is a testament to Bazterrica’s skill that such a bleak book can also be a page-turner. An unrelentingly dark and disquieting look at the way societies conform to committing atrocities.”, —,Kirkus Reviews, , ""Propulsive and deranged, ,Tender Is the Flesh, is a weird and quick read that strays far enough from our current reality to be utterly engrossing... and a book that will stick with you for a long time."", ,—,Thrillist, , ,“,This translated prizewinner by Argentinian novelist Bazterrica exquisitely dishes up an intricate tale of a systematized dystopian society… a sagacious and calculated exploration of the limits of moral ambiguity; it sears and devastates.”, ,—,Booklist,, starred review, , ""This book will pull you in, take hold, and not let go until you reach the final page—perhaps far longer than that. Without a doubt, my favorite read of this year.”, ,—Christina Dalcher, author of ,Vox, , ""What a compelling, terrible beauty this novel is. My heart was breaking even as my skin was crawling.”­­, —,Lisa McInerney, author of ,The Glorious Heresies, , “Provocative, muscular, and entirely unforgiving, this terrifying novel is a timely reminder that words have the power to strip us of our humanity. I gulped it down with my heart racing.”, —,Sue Rainsford, author of ,Follow Me to Ground,  , , “A brutal tale of what humans are capable of inflicting on themselves when social norms collapse. Grotesque, gloriously nasty. Utterly compelling.”, —,Lucie McKnight Hardy, author of ,Water Shall Refuse Them, , ""A skin-crawling yet compelling read."" , —,Refinery29, , ""Grimly engrossing with a sucker-punch ending."" , —,The Times, , ""This is a hideous, bold and unforgettable vision of the future. Just make sure you've eaten before picking it up."" , —,i-D Magazine, , ""[A] thrilling dystopia that everyone should read for Bazterrica's stunning, electrifying language and story-telling—that is, if you can stomach it."", —,Dazed & Confused Magazine, , ""Horribly effective... This provocative novel expertly wields a double-edged cleaver..."", —,The Guardian, , ""A compelling dystopian novel."" , —,The Independent, , ""Told with a chilly allofness that makes the horror of it all the more disturbing."" , —,Financial Times, , ""Sitting comfortably? Not after even the tiniest nibble of this gut-churning, brilliantly realised novel."" , —,Daily Mail, , ""Unflinching... engaging."" , —,SFX Magazine, , “At what price is a world without animals viable? That’s the question posted by Argentinian author Agustina Bazterricca.... With an artfulness perfectly calibrated with irony, [she] presents an astounding portrait of a humanity ready to do anything to satisfy itself, even at its own expense., ,—,Le Monde, , “A dystopic fable as chilling as it is compelling.”, ,—,Paris Match, , “Hypnotic.... [Bazterrica’s] hell is akin to that of Richard Fleischer’s and ,Soylent Green.”, ,—L’Obs, , “From a fear of the future (overpopulation and a shortage of meat), Bazterrica has penned a stunning novel on the plasticity of our moral values, and what Hannah Arendt called 'the banality of evil.'”, ,—,Lire, , “Heiress to Orwell, the Argentinian author deploys a voice as vivid as it is chilling. In an increasingly dehumanized world, she pushes us to a dizzying reflection on violence, love, [and] power."", ,—,Livres Hebdo , , “This Argentinian novel, winner of the Clarin prize in 2017, pulls no punches. Agustina Bazterrica succeeds in normalizing a cruelty beyond words.”, ,—,Le Canard Enchainé, , “A political fable, a denunciation by way of absurdity on the fate society reserves for animals and a love story outside conventional norms, [this novel] seizes you and won’t let go., ,—,Télérama, , ,“,Skilled seamstress, Agustina [Baztericca] unspools her thread and stitches the words to bring us wherever she wants, upending our sensibility through a ride that has everything in a final twist.”, ,—,Maze, , ,“,A fable on the gruesome side of the modern world, impressionistic and poetic.”, ,—,Clarin, , “A biting and uncompromising expression of what happens daily in our society.”, ,—,La Nacion, , “Hypnotic, gruesome, beautiful, captivates the reader within moments.”, ,—El Imparcial, , “Heavy, magnetic, disturbing—the novel of the year.”, ,—,Culturamas,Agustina Bazterrica is an Argentinian novelist and short story writer. She is a central figure in the Buenos Aires literary scene. She won the prestigious Premio Clarin Novela for her second novel, ,Tender Is the Flesh,, which has been translated into twenty-three languages. Several of the stories in ,Nineteen Claws and a Black Bird ,have also won awards, including First Prize in the 2004/2005 City of Buenos Aires Awards for Unpublished Stories and First Prize in the Edmundo Valadés Awards for the Latin American Short Story, among others.",https://m.media-amazon.com/images/G/01/digital/sitb/sticker/sitb-sticker-v3-small._CB485933792_.png
, Vox , ,," 12.99 , 26.00 , 15.49 , 7.23 ","4,597 ",,
Erik Zidowecki,  Dual Language Word Searches - English - Basque - Volume 1 ,"   April 20, 2020 ", 9.99 ,,2 ,,https://m.media-amazon.com/images/G/01/digital/sitb/sticker/sitb-sticker-v3-small._CB485933792_.png
Willow Rose,  Savage (Daughters of the Jaguar Book 1) ,  Kindle Edition ,, 17.99 ,538 ,"Other books in this series:,willow-rose.net ",
Erik Zidowecki,  Dual Language Word Searches - English - Dutch - Volume 1 ,"   April 16, 2020 ", 9.99 ,,,,https://m.media-amazon.com/images/G/01/digital/sitb/sticker/sitb-sticker-v3-small._CB485933792_.png
," Harry Potter and the Sorcerer's Stone, Book 1 ", ,," 13.49 , 6.98 , 24.99 ",914 ,,
くまなの,  Kuma Kuma Kuma Bear (Light Novel) Vol. 7 ,  Kindle Edition , 8.99 , 13.99 ,370 ,"Kumanano, is a Japanese author best known for the ,Kuma Kuma Kuma Bear ,light novels and manga.,029, is a Japanese artist best known for the illustrations in the light novel series ,Kuma Kuma Kuma Bear, and ,The Devil is a Part-Timer!,--This text refers to the , edition.",
Guy Haley,"  Avenging Son (Dawn of Fire: Warhammer 40,000 Book 1) ",  Kindle Edition , 9.99 ,,498 ,,
, Adultery: A Novel , ,," 11.99 , 24.95 , 9.49 , 34.95 ","2,570 ",,
H. G. Wells,  The Invisible Man (AmazonClassics Edition) ,  Kindle Edition ,," 13.98 , 3.60 , 5.95 , 15.00 ","6,226 ",,
Ivy Smoak,  Devotion (The Hunted Series) ,"   October 27, 2016 ", 15.99 , 29.99 ,"7,401 ","""I have always loved this series because of its dense and captivating plot filled with so many emotions.  For anyone who has started the Hunted Series or has read Eruption and is waiting for Devotion, ,IT IS WORTH THE DAMN WAIT,."" - ,Jia Ming from Unfathomable Reads Blog,""This book was amazing! I couldn't put it down. There's heat, sadness, suspense! ,It was sensory overload!,  Ivy did an amazing job! She pulls you in with her writing skills, twists you up and then leaves you in a ,breathless, heart pounding mess,! Loved every second of it!"" - ,Jen from Goodreads,""Devotion evoked so many different emotions in me.  So much happens and at times, it is ,completely heart-stopping,.  The book is filled with mystery, suspense and some surprises that will completely shock the reader. Ivy Smoak truly knows how to grab her readers and hold them captivated until the very end. Thanks Ivy Smoak for giving your readers a satisfying ending to a ,deliciously beautiful story,."" - ,Jennifer from Goodreads,Ivy Smoak is the international bestselling author of The Hunted series. When she's not writing, you can find her binge watching too many TV shows, taking long walks, playing outside, and generally refusing to act like an adult. She lives with her husband in Delaware. ,Get a FREE sexy short story and find out about all her latest releases by joining her newsletter: eepurl.com/byfJUv,Learn more about Ivy on her website at ivysmoak.com or you can find her on:,Facebook/Twitter/Instagram: @IvySmoakAuthor",https://m.media-amazon.com/images/G/01/digital/sitb/sticker/sitb-sticker-v3-small._CB485933792_.png
,"  Indomitus (Warhammer 40,000) ","   August 3, 2021 ", 16.00 , 8.99 ,565 ,"Gav Thorpe is the author of the Horus Heresy novels The First Wall, Deliverance Lost, Angels of Caliban and Corax, as well as the novella The Lion, which formed part of the New York Times bestselling collection The Primarchs, and several audio dramas. He has written many novels for Warhammer 40,000, including Ashes of Prospero, Imperator: Wrath of the Omnissiah and the Rise of the Ynnari novels Ghost Warrior and Wild Rider. He also wrote the Path of the Eldar and Legacy of Caliban trilogies, and two volumes in The Beast Arises series. For Warhammer, Gav has penned the End Times novel The Curse of Khaine, the Warhammer Chronicles omnibus The Sundering, and recently penned the Age of Sigmar novel The Red Feast. In 2017, Gav won the David Gemmell Legend Award for his Age of Sigmar novel Warbeast. He lives and works in Nottingham.",https://m.media-amazon.com/images/G/01/digital/sitb/sticker/sitb-sticker-v3-small._CB485933792_.png
Alissa Noel Grey,"  The Healthy College Cookbook: Quick, Cheap and Easy Meals for Students Who are New to the Kitchen: Healthy, Budget-Friendly Recipes for Every Student (Healthy Eating Made Easy) ","   August 6, 2019 ", 8.99 ,,15 ,,https://m.media-amazon.com/images/G/01/digital/sitb/sticker/sitb-sticker-v3-small._CB485933792_.png
," House of Earth and Blood: Crescent City, Book 1 ", ,," 9.99 , 23.99 , 15.99 , 28.19 ","44,490 ",,
, Everything's Eventual: 14 Dark Tales , ,," 11.99 , 10.50 , 13.00 , 8.56 , 24.96 ","2,329 ",,
Rebecca Yarros,  Fourth Wing ,"  Hardcover – May 2, 2023 ", 26.99 , 14.99 ,,,
Erik Zidowecki,  Dual Language Word Searches - English - Norwegian - Volume 1 ,"   April 18, 2020 ", 9.99 ,,,,https://m.media-amazon.com/images/G/01/digital/sitb/sticker/sitb-sticker-v3-small._CB485933792_.png
Erik Zidowecki,  Dual Language Word Searches - English - Swedish - Volume 1 ,"   April 17, 2020 ", 9.99 ,,2 ,,https://m.media-amazon.com/images/G/01/digital/sitb/sticker/sitb-sticker-v3-small._CB485933792_.png
Dale Ivan Smith,  Empowered: Agent (The Empowered Series Book 1) ,  Kindle Edition , 0.00 , 14.99 ,182 ,,
,"  Overlord, Vol. 15 (light novel) ","  Hardcover – March 21, 2023 ", 18.00 , 9.99 ,,Kugane Maruyama is the author behind the Overlord novel series.,
Sam Maggs,  Critical Role: The Mighty Nein Origins--Nott the Brave ,"  Hardcover – January 31, 2023 ", 16.19 , 10.99 ,,"Sam Maggs is a bestselling author of books, comics, and video games. She’s been a senior games writer, including work on ,Marvel’s Spider-Man,; the author of many YA and middle-grade books like ,The Unstoppable Wasp,, ,Con Quest!,, ,Tell No Tales,, and ,The Fangirl’s Guide to the Galaxy,; and a comics writer for beloved titles like ,Marvel Action: Captain Marvel,, ,My Little Pony,, and ,Transformers,. She is also an on-air host for networks like Nerdist. A Canadian in Los Angeles, she misses Coffee Crisp and bagged milk.",https://m.media-amazon.com/images/G/01/digital/sitb/sticker/sitb-sticker-v3-small._CB485933792_.png
Johanna Wittenberg,  The Queen of Hel (The Norsewomen Book 5) ,  Kindle Edition ,, 13.99 ,34 ,,
Makoto Shinkai,  your name. (light novel) ,"  Hardcover – May 23, 2017 ", 19.64 , 7.99 ,956 ,"Makoto Shinkai is the author of ,your name., The Garden of Words, ,and ,5 Centimeters Per Second. ",https://m.media-amazon.com/images/G/01/digital/sitb/sticker/sitb-sticker-v3-small._CB485933792_.png
Jorge Luis Borges,  The Aleph and Other Stories (Penguin Classics) ,"   July 27, 2004 ", 15.99 ,,187 ,"""He more than anyone renovated the language of fiction and thus opened the way to a remarkable generation of Spanish-American novelists. Gabriel García Márquez, Carlos Fuentes, José Donoso, and Mario Vargas Llosa have all acknowledged their debt to him."" —J,.M. Coetzee,, ,The New York Review of Books,Jorges Luis Borges, was born in Buenos Aires in 1899 and educated in Europe. One of the most widely acclaimed writers of our time, he published many collections of poems, essays and short stories, before his death in Geneva in June 1986. In 1961 Borges shared the International Publishers' Prize with Samuel Beckett. The Ingram Merrill Foundation granted him its Annual Literary Award in 1966 for his ""outstanding contribution to literature."" In 1971 Columbia University awarded him the first of many degrees of Doctor of Letters, honoris causa that he was to receive from the English-speaking world. In 1971 he received the fifth biennial Jerusalem Prize and in 1973 was given the Alfonso Reyes Prize, one of Mexico's most prestigious cultural awards. In 1980 he shared the Cervantes Prize (the Spanish world's highest literary accolade) with Gerardo Diego. Borges was Director of the Argentine National Library from 1955 until 1973. In a tribute to Borges, Mario Vargas Llosa wrote: ""His is a world of clear, pure, and at the same time unusual ideas...expressed in words of great directness and restraint. [He] was a superb storyteller. One reads most of Borges' tales with the hypnotic interest usually reserved for reading detective fiction..."",Andrew Hurley, is a translator of numerous works of literature, criticism, history, and memoir. He is professor emeritus at the University of Puerto Rico.",https://m.media-amazon.com/images/G/01/digital/sitb/sticker/sitb-sticker-v3-small._CB485933792_.png
Erik Zidowecki,  Dual Language Word Searches - English - Danish - Volume 1 ,"   April 18, 2020 ", 9.99 ,,,,https://m.media-amazon.com/images/G/01/digital/sitb/sticker/sitb-sticker-v3-small._CB485933792_.png
,  Indo-European Cognate Dictionary ,"   March 28, 2018 ", 18.75 ," 7.99 , 28.93 - 28.95 ",114 ,,https://m.media-amazon.com/images/G/01/digital/sitb/sticker/sitb-sticker-v3-small._CB485933792_.png
,  Hellsing Deluxe Volume 1 ,"  Hardcover – July 14, 2020 ", 30.99 ,,"2,059 ","Kohta Hirano, is the creator of the ,Drifters, and ,Hellsing, manga series.",
Kazuo Ishiguro,  Klara and the Sun: A novel (Vintage International) ,"   March 1, 2022 ", 14.20 ," 13.99 , 14.98 ","44,493 ",,https://m.media-amazon.com/images/G/01/digital/sitb/sticker/sitb-sticker-v3-small._CB485933792_.png
