Author,BookTitle,Date,PriceAPaperback,PriceBkindle,Ratings,SummaryAuthor,XcoverPicture
Rana Baydoun,"  The Elephant Tooth of '95: An Enchanting Story of Family, Romance and New Beginnings ","   September 8, 2021 ", 15.98 , 23.99 ,51 ,""",The Elephant Tooth of '95: A Story of Family, Romance, and New Beginnings ,is written in a light, conversational style, and while the action has its highs and lows, this is a feel-good read overall. This would appeal to anyone who enjoys personal accounts of everyday experiences, especially those colored by a distinctive cultural and historical setting, as they are in this book. It could make for good beach reading."" - Official Review of Online Book Club,""In equal parts humorous and poignant, The Elephant Tooth of '95 by Rana Baydoun is a wonderful novel whose original plot is buoyed by delightful cultural details. It is a story that inspires strength and hope even during hardship."" ,-  Edith Wairimu for Readers' Favorite.,""An inspiring book for young women to find their way and that taking a chance is a good thing to do to grow as a person. The book took me to another world, and I could not stop reading. It is a story about growing up and overcoming challenges in finding a job, finding love, and your place in society."" -  J M 10 for Online Book Club,""Balances the painful scenes in the story with the livelier sections of Noor's story who always finds the positive and comical in otherwise bad situations. It gives those who have never been in a situation like herself some insight into what life is like in times like hers. Lots of people would relate to this book and could provide them comfort or understanding. It is also a very inspirational book showing how one can strive in such an environment."" - Dagni Botes for Online Book Club,""Through a lens of cheerful naivety, Noor narrates her experiences of starting her career, love, and her quest to find her place in the world. Baydoun takes her readers through the streets of Beirut and explores lovely scenes of Lebanese culture. These vignettes string together a loose plot of a young woman trying to navigate a modernizing world, while still holding on to traditional values. Noor narrates her story with self-deprecating humor that often highlights social differences between her conservative upbringing and the different cultures emerging in Lebanon in the nineties. I would recommend this romance novel as a light summer read."" - Emily Smith for Online Book Club,Rana Baydoun, was born in the buzzing city of Beirut and brought up in a typical Lebanese family amid lots of love and drama. Since she was a little girl, Rana loved telling stories to her school teachers, friends, and hundreds of cousins, aunties, and uncles.Her love for storytelling grew stronger with her when she moved abroad. Even though she lived in amazing cities such as Hamburg, Athens, and Lausanne, Rana always had a strong feeling of nostalgia for her hometown of Beirut. She felt that there was so much more to tell than just the usual cliché news of bombs and power cuts.In her first novel, The Elephant Tooth of 1995 she takes her readers on a compelling rollercoaster journey portraying a typical Lebanese life through the eyes of a young girl called Noor.Rana lives with her husband and three kids and their on & off cat in Dubai.www.ranabaydoun.com",https://m.media-amazon.com/images/G/01/digital/sitb/sticker/sitb-sticker-v3-small._CB485933792_.png
Brom,  Slewfoot: A Tale of Bewitchery ,"  Hardcover – September 14, 2021 ", 25.49 ," 14.99 , 18.98 ","1,119 ","Over the past few decades, acclaimed dark fantasy artist Brom has lent his distinctive vision to all facets of the creative industries, from novels and games to comics and film. He is the author of ,The Child Thief,, ,Krampus,, ,The Lost Gods, and the award-winning illustrated horror novels ,The Plucker, and ,The Devil's Rose,. Brom is currently kept in a dank cellar just outside of Seattle.",https://m.media-amazon.com/images/G/01/digital/sitb/sticker/sitb-sticker-v3-small._CB485933792_.png
," A Dance with Dragons: A Song of Ice and Fire, Book 5 ", ,," 7.99 , 22.22 , 15.80 , 8.49 , 50.84 ","20,643 ",,
, The Lady of the Lake , ,," 9.99 , 27.00 , 15.29 , 42.60 ","9,935 ",,
Sue Lynn Tan,"  Heart of the Sun Warrior: A Novel (Celestial Kingdom, 2) ","  Hardcover – November 15, 2022 ", 21.99 ," 14.99 , 17.99 , 33.27 ",629 ,,https://m.media-amazon.com/images/G/01/digital/sitb/sticker/sitb-sticker-v3-small._CB485933792_.png
"Kassia Omohundro Wedekind,Christy Hermann Thompson","  Hands Down, Speak Out: Listening and Talking Across Literacy and Math ",, 40.66 , 26.49 ,48 ,"""Getting students to lead their own meaningful conversations has always been a challenge, but it might seem impossible in virtual spaces. The book, Hands Down, Speak Out by Kassia Wedekind and Christy Thompson has come out at just the right time.""-Vivian Chen, Literacy Partners ,""This book challenged me to think about facilitating discussions in a whole new way...So I urge you to gather a few colleagues, read this book together, and waste no time in growing and deepening your practice.""-Elham Kazemi, co-author of, Intentional Talk: How to Structure and Lead Productive Mathematical Discussions,""This work has the potential to transform learning communities and lift all individuals within the community. Today is the perfect day to get started!""-Maria Nichols, author of ,Comprehension through Conversation and Building Bigger Ideas,""[Hands Down, Speak Out] is both a timely book and a timeless book...This is the kind of book that I believe will inform teaching and learning for years to come."" -Vivian Maria Vasquez, author of, ,Negotiating Critical Literacies with Young Children,Kassia Omohundro Wedekind, spent many wonderful years as a classroom teacher and math coach in Fairfax County Public Schools in Virginia and now splits her time between being an independent math coach and an editor at Stenhouse Publishers. Her favorite days are spent in classrooms learning from the many ways children talk, listen and negotiate meaning together.,Christy Thompson, is a Literacy Coach in Fairfax County Public Schools in Virginia. She has spent her teaching and coaching career particularly focused on listening and learning from the talk of our youngest learners.",https://m.media-amazon.com/images/G/01/digital/sitb/sticker/sitb-sticker-v3-small._CB485933792_.png
,  Critical Role: The Mighty Nein Origins--Mollymauk Tealeaf ,"  Hardcover – May 16, 2023 ", 16.19 , 10.99 ,,"Jody Houser decided she wanted to be a writer when she was eight years old and never looked back. For better or worse, no one ever suggested that she stop. She earned her MFA in Creative Writing at Emerson College in Boston, where she completed her master's thesis in screenwriting and was a winner of the Rod Parker Fellowship for Playwriting.,Starting in 2006, Jody began experimenting with webcomics. She is the creator behind the webcomic ,Cupcake POW,!, which launched in 2010 and is currently available on comiXology Submit.,Jody has written ,Faith, for Valiant Comics, ,Max Ride: Ultimate Flight, and ,Agent May, for Marvel, and ,Orphan Black, for IDW. She has been a contributing writer to numerous comic anthologies including ,Avengers: No More Bullying,, ,Vertigo CMYK: Magenta,, and both ,Womanthology, series.",
Peter Watts,  Crysis: Legion ,  Kindle Edition , 13.99 , 17.00 ,101 ,"Biologist, author, and convicted felon, Peter Watts (author of ,Blindsight, and the Rifters trilogy)  appears to be especially popular with people who have never met him. At least, pretty much every award his work has received comes from overseas (with the exception of a recent Hugo, which probably won on a sympathy vote in the wake of recent encounters with the Department of Homeland Security).  His science fiction, oddly enough, has been used as a core text in science and philosophy courses as well as the usual gamut of sf electives;  he only wishes his actual science had been taken half as seriously, back in the day.  Both he and his cat have appeared in the prestigious journal ,Nature,.,--This text refers to an alternate , edition.,1,The thing is, I thought it was all our fault.,It's not that far off from what the Greens have been whining about since the last goddamn century. Global warm--sorry, anthropogenic climate change. Tidal waves, rising sea levels, half the planet's population wandering around looking for a place to crash since their homes got flooded out. There's malaria in the Baltic now, did you know that? A tropical disease. In the fucking Baltic. And somehow South America turned into bloody Siberia when no one was looking, something about melting icepacks short-circuiting the ocean currents. The whole world's fighting over fresh water like a pack of starving dogs with one stripped bone among them, and then Brazil started shooting all those sulfates into the stratosphere and--well, it was turning out just like the environazis said, only way worse and way fucking faster. None of the really nasty stuff was supposed to happen for another forty or fifty years, right?,So we're fucked, and it looks like we fucked ourselves, and all the alarmist whitecoats we shat on before are telling us it's too late now, it's all planetary thermal inertia and unstable breakpoints and big ships turn slowly. There's no way to keep the place from blowing up but maybe we can at least contain the explosion a bit, you know? Try to keep the peace, share whatever's left of the loaves and fishes, keep the worst of the riots from hitting the good ol' US of A. Maintain some kind of order.,That's why I signed up. That's why all of us did. We'd fucked things up by snarfing pork rinds and playing video games while the world turned to shit, and joining the marines was-I don't know. Penance. A chance to make amends.,Except it wasn't us after all, not really, not yet. It was these fuckers from outer space, it was that bloody cryo weapon of theirs, that secret run-in way over in fucking China. We may have primed the avalanche, but Ling Shan was the snowball that started it rolling. And that was just a skirmish, that was so small they even managed to cover it up. A presidential directive or two, a few strategic pulse bombs to fry seismo and satcam, maybe a handful of surgical kills to take care of any Koreans out fishing in the wrong place at the wrong time. All you're left with is a few fuzzy rumors so whacked that not even Fox News would stoop low enough to run with them. Then when the whole world starts listing to starboard a couple of months down the road, you blame it all on greedy shortsighted humans and their damn fossil- fuel economy.,But it was just a skirmish, Roger, and you know what?,So's this.,-N2-2 Alcatraz/Prophet (tentative desig.-awaiting update),,excerpted from Manhattan Incursion Debrief,27/08/2023,Voice-mike intercept, Forensic Debrief, Manhattan Incursion,Subject ID: Unknown (code name Alcatraz),27/08/2023,Laurence Barnes, I think. Prophet.,Alcatraz, then. Whatever. It doesn't matter. Of course I know the stats: I'm dead, not senile. Name, rank, serial number. Doesn't mean shit. That's not who I am anymore.,I'm the guy being debriefed by a low-level functionary because his bosses are too chickenshit to risk being in the same room, that's who. You expect me to think you volunteered for this gig? You think the higher-ups wanted to bring you into the loop, you think they wouldn't be in here themselves if they weren't afraid I might go off the reservation again given half a chance?,You're lying.,No, that's an empirical fact. Your skin conductivity just went up 13 percent. Your eye saccades increased by 24. And you don't want to get into your vocal stress harmonics. You may think you sound pretty solid, but believe me: In the upper registers you're squealing like a little girl.,I can tell stuff like that now. It's not the augments--it's not just the augments. I'm not reading numbers off a tactical overlay or anything, it's more--integrated. I just know this shit. I know a lot of things I'm not supposed to.,But you've got nothing to worry about. Really. If I had any interest in killing you, you'd have been dead before you got through the door. You must realize that.,Doesn't help much, does it?,How do you want to do this?,From the top, then: They put us out to sea the moment the media blackout came down. I mean the moment-- Chino was watching Body-Swap Boxing when the Emergency Broadcast Signal cut in. One minute after that MacroNet starts talking about some kind of massive explosion in New York, and literally three minutes after that we're hauling ass down to the water. There's a Swordfish surfacing off the dock, hasn't even finished blowing its tanks before we're piling inside. Haven't even checked our gear. We are mobilized, man, we're moving just this side of outright panic and we don't even know why. They barely get the hatch closed before we're back underwater.,We strap in. You can hear the screws turning through the hull. The Swordfish is basically a troop carrier with a big drive and a few missile tubes thrown in so it won't feel like such a pussy around the hunter-seekers, but even a Sword has the usual stealth options so you can get in and out without a fuss. They're not engaged. Wherever we're going, apparently we can't even afford a lousy 6 percent cloaking deficit.,Then it's a classic case of hurry up and wait. For eighteen hours. Nobody tells us shit, and the shit they do tell us keeps changing. First we're going to be docking with one of those big inflatable jellyfish down in the mesopelagic, keep us safely off the game board until we're needed. I'm thinking that's okay, at least there's decent headroom in those things, at least they're big enough to let you get away from the-but no, now suddenly we're heading back inshore. And then we're circling off Christ-knows-where for fuck-knows-how-long. Some of the guys try to catch a few winks but the CO handed out the usual stims at the six-hour mark so everyone's boosted on GABA and tricyclics and that supernephrin stuff that makes your joints ache for two fucking weeks post-engagement. I keep a forty of tequila in my kit- you know, strictly for medicinal purposes-and I crack it to take the edge off. Offer it around but nobody else wants any. They say it makes a bad mix with all the neurotropes. Pussies.,Anyway, we're strapped in, we're wired, we're climbing the walls. And suddenly the whine of the screws picks up, the night-lights kick in, and the whole compartment turns bloody red, like one of those Asian necro parlors where they use longwave to make the corpses look prettier. It doesn't take an AI to figure out we're deploying to New York but the CO won't even give up that much. Says we'll get briefed on-site. So we're sitting there in our camo, cheek-to-jowl, and everybody's making up these fairy tales to fill in the gaps. Syntheviral attack, moho nukes tunneling up under Broadway, some kind of coup at CENTCOM. Leavenworth--you know Leavenworth? No, of course you don't--Leavenworth weighs in with his usual crazy-ass theories, says he heard some Venter Biomorphs went all Skynet and turned on their masters, and he won't listen to half the squad pointing out that the Venter labs are way the hell over in California and if we're really heading into the replicant wars don't you think they might, you know, airlift us instead of taking a submarine through the Northwest fucking Passage?,I don't think Leavenworth believed that shit half the time himself. I think he just liked yanking our chains. I'm really going to miss him, if I ever get that part of my brain back.,Every now and then you can hear chatter drifting back through the forward hatch; turns out there's at least six other boats deployed, under orders of some Colonel Barclay I've never heard of. And yeah, big surprise, we're all headed up the East River for Upper Manhattan. Except suddenly we aren't. Suddenly we're detached from the main group and diverting to Battery Park. Secret rendezvous, CO tells us. Maybe a rescue mission. I don't know if he's giving it up or making it up.,So everybody's making these wild-ass guesses and Chino even starts a pool for chrissake, right there in the sub, and I'm sitting there and all I can think about is--,You know I was afraid of water, right?,I mean, of course I didn't tell anybody--I worked through it like you're supposed to, even came in third in the open-water trials last year. It's not a problem. But I almost drowned back when I was eight. Kinda stuck with me. You must have known. There were all these tests. You must have sniffed it out during the psych workup.,Thought so.,So everybody's jammed in there with their theories and Chino's got his pool going, and it's been eighteen hours now and I've been white- knuckling the bench for at least ten of 'em. Parchman figures I'm hungover but all I can think about is: a measly seven centimeters of biosteel between me and the whole Atlantic Ocean and I don't care how strong they say it is, a bunch of threads squeezed out of some gengineered spider's ass is not gonna keep an ocean out forever.,Probably the last time I was right about anything in this whole shitstorm.,Finally some voice comes over the comm, tells us it's time to saddle up. And that's when we hear a ping-not sonar, not our sonar anyway, just a single, solid beat resonating throughout the hull. Everybody falls silent for just a second, and Behrendt looks around and says, ""Anybody hear that?""-,And something kicks us hard in the side.,No alarms, nothing coming over the comm link, just one ping and a giant boom and the whole boat's rolling to port. We don't even have time to scream; there's one microscopic whatthefuck moment and the hull opens up like some giant took a can opener to us. The far side of the compartment just crumples: snaps Behrendt's back like a toothpick, turns her into a rag doll right before my eyes, and then a crossbeam or bracket or some fucking thing tears free of the forward bulkhead and squashes Beaudry like a bug.,We're going down, now--the deck's at some crazy-ass angle, there's water flooding in from the bow, the whole damn hull's groaning like a humpback whale. Now the alarms kick in. Or maybe it's just everybody screaming. There's blood everywhere and you'd think it would blend in with the night-vision redlight but it doesn't, it jumps right out at you, it's solid shiny black. By now the water's not even gushing in, it's rising--like a tide, like a liquid floor sliding up to crush us all against the ceiling. Except the ceiling's a wall, and the rear bulkhead is the roof, and--,And--,Look, you--you know this shit. The sub went down. Period. Why do you need the details? You're not making a fucking documentary.,I know, it's just that--,Fine.,So it's every man for himself. I barely even have a chance to take a breath before the ocean closes over my head and I'm diving down, pushing buddies and body parts out of the way, and I'm fucking scared, man, I can't see anything except bloody backlight and blue sparks as the electronics short out. The sub's still groaning around me, it's crumpling into a paper ball and at least the screams stop underwater but you can hear metal grinding on metal as though it were right inside your fucking head. We get through the forward hatch, it's still black and blue and red everywhere except there's this jagged tear off to the side, this blue-black crevice seething with bubbles. I push through. I look up and there's pale dim light, and I look down and there's this great dark wall of metal sliding past, gashed to shit and bleeding rivers of air. Somewhere down there the bow's already hit bottom because there's a big honking cloud of black mud boiling up from below, engulfing the hull like something live. Like something starving.,And all that matters, in that moment, is that I get to the surface.,There's no Semper-fucking-fi down there in the deeps, let me tell you. Maybe if I'd had my rebreather on. Maybe if I'd had more than one lousy lungful of air to get me thirty meters to the surface. Maybe if I wasn't fighting off flashbacks from fifteen years ago. But no: I don't try to free the trapped or assist the wounded or carry the unconscious to safety on my back. I don't even think about it. There are things in my way: Some are sharp and hard and some are soft and gooshy and I don't fucking care, man, I bull through them all without prejudice or favoritism. I'm an eight-year-old kid again, and I'm dying, and I know what that feels like. Not again. God, not again.,So I'm fighting my way to the surface. Didn't even have the presence of mind to grab a pair of fins, you know, I'm just kicking at the ocean with these stupid little ape feet and all I know is it's dark in one direction and a little less dark in the other and my chest is so tight it feels like it's going to burst, like somehow I've got a whole roomful of air jammed in there ready to explode. And it almost does, I almost suffer a fucking embolism before I remember that that last gulp of air I took, it was under pressure: the closer I get to the surface the more it expands, the harder it pushes to get out. So I open my mouth. I open my mouth and I vomit all that precious air into the sea and I follow the bubbles as fast as I can, I pray to God the air doesn't bleed out of me faster than it swells up inside. I'm kicking and clawing at the water and suddenly the light overhead has texture somehow, that dull greenish glow resolves into distinct shafts of light and they're dancing, I swear to God they're dancing. Suddenly there's a roof over my head, like a writhing mirror, like mercury, and I break through and I feel like I could swallow the whole fucking sky and I'm so glad to be alive, man, you have no idea. I couldn't care less about Behrendt or Chino or even poor old conspiracy-crackpot Leavenworth. I'm so glad to be alive I don't even notice the hellscape I've dragged myself into--,Oh, that.,Yeah, I am a bit more eloquent than I used to be. Sometimes. Writhing mirrors and dancing lights. Never used to talk like that before. Now I just, you know. Switch back and forth. Don't even notice it half the time.,--This text refers to an alternate , edition.",
Lumos Learning,  Lumos Skills Mastery tedBook - 8th Grade English Language Arts: Standards-based ELA practice workbook (Skills Mastery by Lumos Learning) ,, 3.19 - 19.95 ,,116 ,,https://m.media-amazon.com/images/G/01/digital/sitb/sticker/sitb-sticker-v3-small._CB485933792_.png
